Sheet: Sheet1
A2: Quelques explications :
A3: en rouge figurent les informations qui peuvent changer d'un contrat à l'autre. Il faut donc les adapter à chaque contrat.
A4: en bleu, il s'agit des informations qui changent tous les mois. Par défaut, le nombre d'heures dans une semaine ne peut pas être inférieur au nombre d'heures prévues.
A6: Calcul de paie
A7: Nombre d'heures prévues par semaine | B7: 27
A9: Semaine 1 | B9: of:=27 -> 27
A10: Semaine 2 | B10: 27
A11: Semaine 3 | B11: 27
A12: Semaine 4 | B12: 27
A14: Heures complémentaires | B14: of:=-4*[.B7]+[.B9]+[.B10]+[.B11]+[.B12] -> 0
A15: Salaire Net de base | B15: 223.15
A16: Prix horaire net | B16: 2.61
A17: Prix horaire brut | B17: 3.38
A19: Montant des congés payés du mois | B19: of:=([.B15]+[.B14]*[.B16])/10 -> 22.315
A20: SALAIRE DU MOIS A PAYER SANS IJ | B20: of:=([.B15]+[.B14]*[.B16])+[.B19]+([.B17]*[.B14])/10 -> 245.465
A22: Indemnités journalière | B22: 2.86
A23: Nombre de jours réels travaillés | B23: 0
A24: SALAIRE DU MOIS A PAYER | B24: of:=[.B20]+[.B22]*[.B23] -> 245.465
A26: Heures normales à déclarer à Pajemploi | B26: of:=[.B20]/[.B16] -> 94.0478927203065
A27: Nombre de jours à déclarer à Pajemploi | B27: of:=[.B26]/8 -> 11.7559865900383